{
  "format": "stasium.world_npcs",
  "format_version": 1,
  "status": "proposed",
  "npcs": [
    {
      "id": "crossroads_guide",
      "name": "Guide",
      "role": "guide",
      "zone_id": "crosshaven_crossroads",
      "cell": {
        "x": 24,
        "y": 18
      },
      "facing": "S",
      "body": "npc_guide",
      "lines": [
        "Welcome to Crosshaven.",
        "Click the ground to walk. Gold arrows lead on."
      ],
      "status": "proposed"
    },
    {
      "id": "crossroads_warden",
      "name": "Warden",
      "role": "warden",
      "zone_id": "crosshaven_crossroads",
      "cell": {
        "x": 21,
        "y": 13
      },
      "facing": "S",
      "body": "npc_warden",
      "lines": [
        "I am the Warden of Crosshaven Heart.",
        "This band is levels 1 to 5."
      ],
      "status": "proposed"
    },
    {
      "id": "crossroads_trader",
      "name": "Trader",
      "role": "trader",
      "zone_id": "crosshaven_crossroads",
      "cell": {
        "x": 17,
        "y": 16
      },
      "facing": "E",
      "body": "npc_trader",
      "lines": [
        "I trade in Crosshaven Heart.",
        "The shop is not open yet."
      ],
      "status": "proposed"
    },
    {
      "id": "crossroads_herald",
      "name": "Koliseo Herald",
      "role": "herald",
      "zone_id": "crosshaven_crossroads",
      "cell": {
        "x": 17,
        "y": 19
      },
      "facing": "E",
      "body": "npc_herald",
      "lines": [
        "I am the Koliseo Herald.",
        "The arena list is not open yet."
      ],
      "status": "proposed"
    },
    {
      "id": "crossroads_banker",
      "name": "Banker",
      "role": "banker",
      "zone_id": "crosshaven_crossroads",
      "cell": {
        "x": 20,
        "y": 20
      },
      "facing": "S",
      "body": "npc_banker",
      "lines": [
        "I keep the Crypto Bank.",
        "The bank is not open yet."
      ],
      "status": "proposed"
    },
    {
      "id": "granary_door_keeper",
      "name": "Door Keeper",
      "role": "door_keeper",
      "zone_id": "crosshaven_stoneford",
      "cell": {
        "x": 15,
        "y": 11
      },
      "facing": "S",
      "body": "npc_door_keeper",
      "lines": [
        "I keep the door to Old Granary Cellar.",
        "Rats in the grain again. Mind the Ratking down there."
      ],
      "status": "proposed"
    },
    {
      "id": "towns_warden",
      "name": "Warden",
      "role": "warden",
      "zone_id": "crosshaven_northgate",
      "cell": {
        "x": 2,
        "y": 5
      },
      "facing": "W",
      "body": "npc_warden",
      "lines": [
        "I am the Warden of Crosshaven Towns.",
        "This band is levels 5 to 10."
      ],
      "status": "proposed"
    },
    {
      "id": "towns_trader",
      "name": "Trader",
      "role": "trader",
      "zone_id": "crosshaven_northgate",
      "cell": {
        "x": 15,
        "y": 10
      },
      "facing": "E",
      "body": "npc_trader",
      "lines": [
        "I trade in Crosshaven Towns.",
        "The shop is not open yet."
      ],
      "status": "proposed"
    },
    {
      "id": "northgate_elder",
      "name": "Northgate Elder",
      "role": "elder",
      "zone_id": "crosshaven_northgate",
      "cell": {
        "x": 20,
        "y": 17
      },
      "facing": "S",
      "body": "npc_elder",
      "lines": [
        "I am the Elder of Northgate.",
        "A respec is not open yet."
      ],
      "status": "proposed"
    },
    {
      "id": "stoneford_elder",
      "name": "Stoneford Elder",
      "role": "elder",
      "zone_id": "crosshaven_stoneford",
      "cell": {
        "x": 19,
        "y": 16
      },
      "facing": "S",
      "body": "npc_elder",
      "lines": [
        "I am the Elder of Stoneford.",
        "A respec is not open yet."
      ],
      "status": "proposed"
    },
    {
      "id": "eastmarch_elder",
      "name": "Eastmarch Elder",
      "role": "elder",
      "zone_id": "crosshaven_eastmarch",
      "cell": {
        "x": 19,
        "y": 16
      },
      "facing": "S",
      "body": "npc_elder",
      "lines": [
        "I am the Elder of Eastmarch.",
        "A respec is not open yet."
      ],
      "status": "proposed"
    },
    {
      "id": "westwatch_elder",
      "name": "Westwatch Elder",
      "role": "elder",
      "zone_id": "crosshaven_westwatch",
      "cell": {
        "x": 17,
        "y": 16
      },
      "facing": "S",
      "body": "npc_elder",
      "lines": [
        "I am the Elder of Westwatch.",
        "A respec is not open yet."
      ],
      "status": "proposed"
    },
    {
      "id": "southbridge_elder",
      "name": "Southbridge Elder",
      "role": "elder",
      "zone_id": "crosshaven_southbridge",
      "cell": {
        "x": 19,
        "y": 16
      },
      "facing": "S",
      "body": "npc_elder",
      "lines": [
        "I am the Elder of Southbridge.",
        "A respec is not open yet."
      ],
      "status": "proposed"
    },
    {
      "id": "stoneford_smith",
      "name": "Smith",
      "role": "smith",
      "zone_id": "crosshaven_stoneford",
      "cell": {
        "x": 26,
        "y": 11
      },
      "facing": "S",
      "body": "npc_smith",
      "lines": [
        "I am the Smith of Stoneford.",
        "The forge bench is not open yet."
      ],
      "status": "proposed"
    },
    {
      "id": "eastmarch_fisher",
      "name": "Fisher",
      "role": "fisher",
      "zone_id": "crosshaven_eastmarch",
      "cell": {
        "x": 24,
        "y": 11
      },
      "facing": "S",
      "body": "npc_fisher",
      "lines": [
        "I am the Fisher of Eastmarch.",
        "The docks are this town's water."
      ],
      "status": "proposed"
    },
    {
      "id": "drowned_abbey_door_keeper",
      "name": "Door Keeper",
      "role": "door_keeper",
      "zone_id": "crosshaven_southbridge",
      "cell": {
        "x": 23,
        "y": 26
      },
      "facing": "S",
      "body": "npc_door_keeper",
      "lines": [
        "I keep the door to the Drowned Abbey.",
        "The Mire Abbess raises what you fell. Put her down first, or stand where they dropped."
      ],
      "status": "proposed"
    },
    {
      "id": "stoneford_warden",
      "name": "Warden",
      "role": "warden",
      "zone_id": "crosshaven_stoneford",
      "cell": {
        "x": 8,
        "y": 1
      },
      "facing": "N",
      "body": "npc_warden",
      "lines": [
        "I am the Warden of Stoneford.",
        "This band is levels 1 to 10."
      ],
      "status": "proposed"
    },
    {
      "id": "stoneford_trader",
      "name": "Trader",
      "role": "trader",
      "zone_id": "crosshaven_stoneford",
      "cell": {
        "x": 13,
        "y": 16
      },
      "facing": "S",
      "body": "npc_trader",
      "lines": [
        "I trade in Stoneford.",
        "The shop is not open yet."
      ],
      "status": "proposed"
    },
    {
      "id": "stoneford_farmer",
      "name": "Farmer",
      "role": "farmer",
      "zone_id": "crosshaven_stoneford",
      "cell": {
        "x": 16,
        "y": 18
      },
      "facing": "S",
      "body": "npc_farmer",
      "lines": [
        "The fields are mine to tend.",
        "The harvest can wait."
      ],
      "status": "proposed"
    },
    {
      "id": "stoneford_woodcutter",
      "name": "Woodcutter",
      "role": "woodcutter",
      "zone_id": "crosshaven_stoneford",
      "cell": {
        "x": 16,
        "y": 21
      },
      "facing": "S",
      "body": "npc_woodcutter",
      "lines": [
        "I cut timber for Stoneford.",
        "The axe is down for now."
      ],
      "status": "proposed"
    },
    {
      "id": "northgate_door_keeper",
      "name": "Door Keeper",
      "role": "door_keeper",
      "zone_id": "crosshaven_northgate",
      "cell": {
        "x": 20,
        "y": 10
      },
      "facing": "S",
      "body": "npc_door_keeper",
      "lines": [
        "I keep the door to Frostspire Archive.",
        "The pages fly loose below. Mind the Pale Archivist."
      ],
      "status": "proposed"
    },
    {
      "id": "northgate_archivist",
      "name": "Archivist",
      "role": "archivist",
      "zone_id": "crosshaven_northgate",
      "cell": {
        "x": 19,
        "y": 13
      },
      "facing": "S",
      "body": "npc_archivist",
      "lines": [
        "I keep the Archive's lists.",
        "The shelves are not open yet."
      ],
      "status": "proposed"
    },
    {
      "id": "northgate_forge_master",
      "name": "Forge Master",
      "role": "forge_master",
      "zone_id": "crosshaven_northgate",
      "cell": {
        "x": 23,
        "y": 12
      },
      "facing": "S",
      "body": "npc_forge_master",
      "lines": [
        "I am the Forge Master of Northgate.",
        "The forge is cold for now."
      ],
      "status": "proposed"
    },
    {
      "id": "eastmarch_warden",
      "name": "Warden",
      "role": "warden",
      "zone_id": "crosshaven_eastmarch",
      "cell": {
        "x": 33,
        "y": 1
      },
      "facing": "N",
      "body": "npc_warden",
      "lines": [
        "I am the Warden of Eastmarch.",
        "This band is levels 20 to 30."
      ],
      "status": "proposed"
    },
    {
      "id": "eastmarch_trader",
      "name": "Trader",
      "role": "trader",
      "zone_id": "crosshaven_eastmarch",
      "cell": {
        "x": 14,
        "y": 14
      },
      "facing": "S",
      "body": "npc_trader",
      "lines": [
        "I trade in Eastmarch.",
        "The shop is not open yet."
      ],
      "status": "proposed"
    },
    {
      "id": "eastmarch_door_keeper",
      "name": "Door Keeper",
      "role": "door_keeper",
      "zone_id": "crosshaven_eastmarch",
      "cell": {
        "x": 25,
        "y": 17
      },
      "facing": "S",
      "body": "npc_door_keeper",
      "lines": [